{
  "record_format_version": "v0.1",
  "artifact_type": "TRANSACTION_ALLOCATION",
  "transaction_id": "FILE-0001-TXN-0005",
  "case_id": "FILE-0001",
  "allocated_by_actor_id": "ACTOR-0001",
  "allocated_by_actor_role": "Image Agent",
  "allocated_at": "2026-09-19T15:14:36.132636Z",
  "transaction_origin": "NORMAL"
}
